{
  "$schema": "https://json-schema.org/draft/2020-12/schema",
  "$id": "urn:f1-cache-replay:schema:replay-data:v1:chunk",
  "title": "Column-oriented replay data chunk",
  "description": "Schema for a committed column-oriented replay chunk in the Phase 0 v1 offline replay contract. Semantic validation enforces that every column is aligned to timeMs.",
  "type": "object",
  "additionalProperties": false,
  "required": [
    "contractVersion",
    "fixtureId",
    "chunkId",
    "sequence",
    "startMs",
    "endMs",
    "overlap",
    "timeMs",
    "authoritativeStartIndex",
    "drivers",
    "leaderboardOrder",
    "trackStatusCode",
    "weatherState",
    "events"
  ],
  "$defs": {
    "driverCode": {
      "type": "string",
      "pattern": "^[A-Z0-9]{2,4}$"
    },
    "sessionTimeMs": {
      "type": "integer",
      "minimum": 0
    },
    "nullableNumber": {
      "type": [
        "number",
        "null"
      ]
    },
    "timeRange": {
      "type": "object",
      "additionalProperties": false,
      "required": [
        "startMs",
        "endMs"
      ],
      "properties": {
        "startMs": {
          "$ref": "#/$defs/sessionTimeMs"
        },
        "endMs": {
          "$ref": "#/$defs/sessionTimeMs"
        }
      }
    },
    "chunkFileReference": {
      "type": "object",
      "additionalProperties": false,
      "required": [
        "sequence",
        "path",
        "schemaId",
        "startMs",
        "endMs",
        "overlapWithPreviousMs"
      ],
      "properties": {
        "sequence": {
          "type": "integer",
          "minimum": 1
        },
        "path": {
          "type": "string",
          "pattern": "^chunks/chunk-(?:00[1-9]|0[1-9][0-9]|[1-9][0-9]{2,})\\.json$"
        },
        "schemaId": {
          "const": "urn:f1-cache-replay:schema:replay-data:v1:chunk"
        },
        "startMs": {
          "$ref": "#/$defs/sessionTimeMs"
        },
        "endMs": {
          "$ref": "#/$defs/sessionTimeMs"
        },
        "overlapWithPreviousMs": {
          "type": "integer",
          "minimum": 0
        },
        "sha256": {
          "type": "string",
          "pattern": "^[0-9a-f]{64}$"
        }
      }
    },
    "overlapNone": {
      "type": "object",
      "additionalProperties": false,
      "required": [
        "kind",
        "previousChunkPath",
        "range",
        "authoritativeFromMs"
      ],
      "properties": {
        "kind": {
          "const": "none"
        },
        "previousChunkPath": {
          "type": "null"
        },
        "range": {
          "type": "null"
        },
        "authoritativeFromMs": {
          "type": "null"
        }
      }
    },
    "overlapHandoff": {
      "type": "object",
      "additionalProperties": false,
      "required": [
        "kind",
        "previousChunkPath",
        "range",
        "authoritativeFromMs"
      ],
      "properties": {
        "kind": {
          "const": "handoff"
        },
        "previousChunkPath": {
          "type": "string",
          "pattern": "^chunks/chunk-(?:00[1-9]|0[1-9][0-9]|[1-9][0-9]{2,})\\.json$"
        },
        "range": {
          "$ref": "#/$defs/timeRange"
        },
        "authoritativeFromMs": {
          "$ref": "#/$defs/sessionTimeMs"
        }
      }
    },
    "nullableInteger": {
      "type": [
        "integer",
        "null"
      ]
    },
    "nullableString": {
      "type": [
        "string",
        "null"
      ]
    },
    "nullableBoolean": {
      "type": [
        "boolean",
        "null"
      ]
    },
    "nullableNumberColumn": {
      "type": "array",
      "items": {
        "$ref": "#/$defs/nullableNumber"
      }
    },
    "nullableNonNegativeNumber": {
      "type": ["number", "null"],
      "minimum": 0
    },
    "nullableNonNegativeNumberColumn": {
      "type": "array",
      "items": {"$ref": "#/$defs/nullableNonNegativeNumber"}
    },
    "driverColumns": {
      "type": "object",
      "additionalProperties": false,
      "required": [
        "x",
        "y",
        "trackDistanceMeters",
        "speed",
        "throttle",
        "brake",
        "gapToLeaderMs",
        "lap",
        "position",
        "gear",
        "drs",
        "tyreCompound",
        "status",
        "isInPitLane"
      ],
      "properties": {
        "x": {
          "$ref": "#/$defs/nullableNumberColumn"
        },
        "y": {
          "$ref": "#/$defs/nullableNumberColumn"
        },
        "trackDistanceMeters": {
          "$ref": "#/$defs/nullableNonNegativeNumberColumn"
        },
        "speed": {
          "$ref": "#/$defs/nullableNumberColumn"
        },
        "rpm": {
          "$ref": "#/$defs/nullableNumberColumn"
        },
        "throttle": {
          "$ref": "#/$defs/nullableNumberColumn"
        },
        "brake": {
          "$ref": "#/$defs/nullableNumberColumn"
        },
        "gapToLeaderMs": {
          "$ref": "#/$defs/nullableNonNegativeNumberColumn"
        },
        "lap": {
          "type": "array",
          "items": {
            "allOf": [
              {
                "$ref": "#/$defs/nullableInteger"
              },
              {
                "minimum": 1
              }
            ]
          }
        },
        "position": {
          "type": "array",
          "items": {
            "allOf": [
              {
                "$ref": "#/$defs/nullableInteger"
              },
              {
                "minimum": 1
              }
            ]
          }
        },
        "gear": {
          "type": "array",
          "items": {
            "allOf": [
              {
                "$ref": "#/$defs/nullableInteger"
              },
              {
                "minimum": 0,
                "maximum": 8
              }
            ]
          }
        },
        "drs": {
          "type": "array",
          "items": {
            "allOf": [
              {
                "$ref": "#/$defs/nullableInteger"
              },
              {
                "minimum": 0
              }
            ]
          }
        },
        "tyreCompound": {
          "type": "array",
          "items": {
            "allOf": [
              {
                "$ref": "#/$defs/nullableString"
              },
              {
                "minLength": 1
              }
            ]
          }
        },
        "tyreAge": {
          "type": "array",
          "items": {
            "allOf": [
              {
                "$ref": "#/$defs/nullableInteger"
              },
              {
                "minimum": 0
              }
            ]
          }
        },
        "status": {
          "type": "array",
          "items": {
            "allOf": [
              {
                "$ref": "#/$defs/nullableString"
              },
              {
                "minLength": 1
              }
            ]
          }
        },
        "isInPitLane": {
          "type": "array",
          "items": {
            "$ref": "#/$defs/nullableBoolean"
          }
        },
        "isFinished": {
          "type": "array",
          "items": {
            "$ref": "#/$defs/nullableBoolean"
          }
        }
      }
    },
    "event": {
      "type": "object",
      "additionalProperties": false,
      "required": [
        "sessionTimeMs",
        "eventType",
        "description"
      ],
      "properties": {
        "sessionTimeMs": {
          "$ref": "#/$defs/sessionTimeMs"
        },
        "eventType": {
          "type": "string",
          "minLength": 1
        },
        "driverId": {
          "type": [
            "string",
            "null"
          ],
          "pattern": "^[A-Z0-9]{2,4}$"
        },
        "description": {
          "type": "string",
          "minLength": 1
        },
        "payload": {
          "type": "object"
        }
      }
    },
    "fixtureId": {
      "type": "string",
      "pattern": "^[a-z0-9]+(?:-[a-z0-9]+)*$"
    }
  },
  "properties": {
    "contractVersion": {
      "const": "v1"
    },
    "fixtureId": {
      "$ref": "#/$defs/fixtureId"
    },
    "chunkId": {
      "type": "string",
      "pattern": "^chunk-(?:00[1-9]|0[1-9][0-9]|[1-9][0-9]{2,})$"
    },
    "sequence": {
      "type": "integer",
      "minimum": 1
    },
    "startMs": {
      "$ref": "#/$defs/sessionTimeMs"
    },
    "endMs": {
      "$ref": "#/$defs/sessionTimeMs"
    },
    "overlap": {
      "oneOf": [
        {
          "$ref": "#/$defs/overlapNone"
        },
        {
          "$ref": "#/$defs/overlapHandoff"
        }
      ]
    },
    "timeMs": {
      "type": "array",
      "minItems": 1,
      "items": {
        "$ref": "#/$defs/sessionTimeMs"
      }
    },
    "authoritativeStartIndex": {
      "type": "integer",
      "minimum": 0
    },
    "drivers": {
      "type": "object",
      "minProperties": 1,
      "propertyNames": {
        "$ref": "#/$defs/driverCode"
      },
      "additionalProperties": {
        "$ref": "#/$defs/driverColumns"
      }
    },
    "leaderboardOrder": {
      "type": "array",
      "items": {
        "oneOf": [
          {
            "type": "array",
            "minItems": 1,
            "uniqueItems": true,
            "items": {"$ref": "#/$defs/driverCode"}
          },
          {"type": "null"}
        ]
      }
    },
    "trackStatusCode": {
      "type": "array",
      "items": {
        "type": ["integer", "null"],
        "minimum": 0
      }
    },
    "weatherState": {
      "type": "array",
      "items": {
        "type": ["string", "null"],
        "minLength": 1
      }
    },
    "events": {
      "type": "array",
      "items": {
        "$ref": "#/$defs/event"
      }
    }
  }
}
